cat,text
news_world,这些奇葩的人告诉你，什么叫“艺高人胆大”
news_entertainment,王丽坤：出席活动，网友：就这个发型就能惊艳全场了
news_culture,如何理解儒释道同根的观点？
news_sports,朱婷会不会转会，如何看她在瓦基弗银行队赛季总结会的讲话？
news_finance,氯化铵：干铵、湿铵“人鬼殊途”
news_world,夏威夷火山发威后又地震 近万人强制疏散
news_tech,他是京东最辛苦的人为了企业一夜白发，如今创造了719亿美金市值
news_agriculture,入户走访贫困户 精准扶贫暖民心
news_sports,国乒选择放弃用平板车运送奖杯，转而用精美包装盒运送奖杯，你觉得哪个更霸气？
news_house,结婚十年公婆想全款买一套房子写他儿子的名字，生活中如果发生意外，妻子能分这套房吗？
news_culture,为什么好多人都说儒家思想祸害中国？
news_military,歼20高性能是累赘？中国一项技术获重大突破，可迅速在雷达上消失
news_finance,复盘 美方狮子大开口，A股将何去何从？
news_tech,灵雀云获英特尔战略投资，加速抢占容器PaaS制高点
news_agriculture,什么品牌的矮壮素能防止玉米倒伏？使用防倒剂对玉米有何影响？
news_entertainment,言承旭的内地真人秀首秀：带娃！
news_edu,名牌大学毕业后考上公务员，发现同批进入的男生都是三本人员，很委屈，怎么调整？
news_game,你打游戏时会骂人或者被骂吗？对这种行为你怎么看待？
news_culture,「考古词条」青铜时代 · 斗鸡台墓地
news_world,去西班牙旅游安全吗？
news_tech,联想把5G关键票投给了高通，掀起全国的舆论风暴，企业有权利按照自己意愿决择吗？
news_agriculture,县安监局积极参与县禁毒委禁毒工作
news_edu,学生了解这个知识点，不仅提高习作水平，做阅读理解也高屋建瓴
news_edu,叶罗丽测试：选一个握笔姿势，测你考试成绩超越了谁？我的是同桌
news_world,海湾战争期间，伊拉克空军为什么大规模逃往伊朗被伊朗扣留？
news_house,住房公积金，没房贷，怎么提取？
news_finance,一汽夏利陷窘境何去何从引关注
news_world,一些国家总是嫉妒中国与柬埔寨关系，为何自己不来还要指责中国？
news_story,瞎子贺半仙（民间故事）
news_sports,这些巨星都喜爱夜蒲泡妞，在场上依然是一位好球员！
news_culture,今小编推荐一组行草书法作品，请欣赏一下吧
news_finance,旧上海著名的青帮头目，蒋介石的师父，一句话解决了蒋所有债务
news_military,中国99主战坦克为何敢单枪匹马打巷战？对手担心眼睛睁不开
news_car,鹤壁68岁老人驾照考试“一次过”：年轻人要多学多练
news_game,第五人格时装2.0时代开启！红蝶顶级时装即将上线，天使只是开端
news_culture,只愿君心似我心，下句如何对？
news_world,利比亚难民后后悔推翻卡扎菲吗？
news_entertainment,最新出道的一位画家：杨紫=羊紫 网友已笑喷
news_world,王宪举：俄经济发展瓶颈的借鉴意义
news_entertainment,欧弟孕妻怀二胎数月体重才破百，还称被女儿“嘲笑”！
news_travel,天门山国家森林公园——湖南张家界
news_agriculture,玉米的八种花式做法，小编已确认过吃货的小眼神，好吃！绝对靠谱
news_world,反对派强烈要求外国军队撤离，一旦没了俄军，巴沙尔还撑得下去吗？
news_edu,青岛颁出课外减负令 一二年级不布置书面课后作业
news_car,和思域的发动机规格一样，最低售价10万，完全可以媲美思域！
news_tech,降至3498元，vivo XPlay6还能满足需求吗？
news_game,DNF：远古异界即将合并，大小商机袭来，交你如何发家致富
news_game,王者荣耀主播张大仙被坑的连败也不骂人，是套路还是性格？
news_tech,如果腾讯和阿里拒绝苹果手机使用微信和支付宝，苹果手机大概多久要退出中国市场？
news_sports,火箭传来坏消息！卡佩拉顶薪加盟太阳？火箭：不惜一切代价留住他
news_culture,《中国百家姓》摄制组孔庙拍摄工作侧记
news_entertainment,盘点汤姆克鲁斯的五个最差表演，你是不是也不喜欢呢？
news_tech,大佬干架：腾讯马化腾和今日头条张一鸣的恩怨情仇
news_military,哪些国家支持德国成为联合国安理会常任理事国？
news_car,拿到驾照后，这些知识你需要知道
news_entertainment,全球最贵超模吉赛尔·邦辰身穿金色礼服和老公甜蜜亮相，风采依旧
news_entertainment,周杰伦的这些冷门电影，看过3部算我输！
news_car,宾智的车怎样？
news_car,大家怎么看待传祺GS4的安全性？
news_sports,图集｜丁俊晖入名人堂徐思最佳新人奖，奥沙利文再度年度最佳球员
news_sports,那个从一号位打到教练位置的男人，他又lei了！
news_world,美华人女子遭遇入室盗窃 躲进厕所度过惊魂5分钟
news_tech,功能体验报告｜小米是如何将你的手机变成门禁卡的？
news_culture,《倚天屠龙记》中，空见神僧有多厉害，是什么水平？
news_car,蔚领有没有出现烧机油的情况？
news_sports,GOAL神奇：拜仁连续折戟欧冠原因终于找到 队内金靴与旗帜是祸首
news_house,买房户型怎么选？几招教你巧妙辨别烂户型！
news_story,因生个女儿月子里婆婆的做法令她心寒，满月后她的做法让婆婆痛哭
news_sports,如何看待巴萨赛季不败金身被破？
news_house,为什么重庆的房子是50年产权？
news_house,个人房产税税率怎么算？
news_world,投票事件过后，联想今后的日子该怎样走？
news_sports,中超争冠群扩大到5支，上港恒大鲁能国安苏宁都有夺冠可能，哪一支球队能笑傲江湖？
news_game,盘点王者荣耀中秒人最快的3个英雄，最后一位实在是太尴尬！
news_culture,方舟子说象棋源自印度，中国古代没有大象，你认为这种说法怎么样？
news_car,自动挡车D1、D2、D3是什么意思？
news_sports,恩比德暴扣之后挑衅莫里斯，被莫里斯3-0手势嘲讽，大帝龙颜扫地
news_entertainment,张柏芝小儿子Quintus生日，柏芝送上生日祝福
news_entertainment,《妈妈是超人》嗯哼讲绕口令时，有谁注意到霍思燕家床上是什么？
news_culture,上联：东南西北方方利，如何对下联？
news_sports,世界足坛十大伤仲永球员，如此天赋却自甘堕落，令人扼腕叹息
news_entertainment,赵丽颖最怕的一个人，但是却是最宠她的人，你知道他们的关系吗？
news_car,方向盘忘记回正了，处女座的你看到了会抓狂吗
news_world,日本都市中的“隐士”：有人在家宅十年，吃喝靠父母
news_car,2018款奥迪A4L 30周年40TFSI运动型落地多少钱？
news_finance,景瑞控股2.4亿收购北京东城区4.3万平商业物业100%所有权股
news_culture,花开江水笑，下联应该怎么对？
news_edu,常说这5句话，容易培养出高情商孩子！
news_military,哪些国家的军事比较强？
news_entertainment,罗晋被问什么时候和唐嫣结婚，他微笑着说了两个字
news_world,美国的FBI和警察有什么区别？
news_finance,GoPro销量增长收入下降，销售势头良好将增加营销支出
news_edu,“母亲节”感恩教育
news_sports,读《2017中国马拉松年度总结》（5）全马半马完赛人次趋势分析
news_entertainment,泰星pong和noon这对好朋友，感情好到可以给对方介绍男女朋友
news_house,如何判断房价是真高还是虚高？
news_sports,粤媒：恒大闷平完成基本目标 客场战绩差影响争冠
news_tech,努比亚系统升级到5.0怎么样？
news_tech,“三化”彩电、八大新规！疲软的彩电市场苏宁有高招
news_game,炉石传说：精选玩家创意秀，能够复活英雄的克总会很强吗？
news_car,汽车上的cvt为什么要用钢带？
news_edu,一位妈妈的反思和分享：直到孩子上了初中，才明白小学该怎么学
news_culture,转着吃席 白水三转席走红“丝绸之路”陕菜发展研讨会
news_world,强大的俄罗斯对世界是和平还是威胁？
news_world,巴沙尔是个好总统吗？
news_agriculture,怎样做到高效养鸡？从哪儿着手呢？
news_world,92岁高龄的马哈蒂尔赢得第14届马来西亚大选意味着什么？
news_sports,郭士强在辽宁队夺冠之后前往欧洲学习。你怎么看？
news_edu,高考收藏系列之招生骗术预警
news_entertainment,富家女求灰姑娘帮忙假冒自己见总裁，没想两人阴差阳错，一见钟情
news_game,DNF列车追击战五一活动玩法和奖励引热议 网友：DNF日常又要黄
news_agriculture,美媒：如果大豆能卖个好价钱，中国农民渴望加入中美贸易战
news_culture,《立 夏》山林子自然道德智慧诗
news_story,女孩遭校园霸凌跳楼自杀，收拾遗物时她闺蜜神情让我发现不对
news_sports,申花VS重庆首发：莫雷诺瓜林登场 小摩托缺阵阿吉雷入替
news_finance,一季度GDP增速居重点城市倒数，被深圳甩开，广州怎么了？
news_entertainment,马苏范冰冰女王范走红毯，李宇春黑翅膀如凤凰般更亮眼！
news_edu,大学生到底该不该在校期间进行创业？
news_world,一反常态！伊朗表态为何不强硬？美国退出伊核协议影响莫非不大？
news_world,警方确定法拉盛暴力性侵华妇男嫌身份
news_culture,上联：泰山黄山赵本山，如何对下联？
news_entertainment,范冰冰的17岁，刘亦菲的17岁，高圆圆的17岁，都输给了李小璐
news_story,带老婆去姑家，饭桌上姑姑不停给她夹菜，扭头我们去了民政局
news_edu,母亲节：沈阳和平区传递崇德敬亲之情
news_agriculture,“人造猪肉”于近期面世，猪价会有挽回的余地吗？
news_world,特朗普嘲讽奥巴马：他花18亿救人，我让朝鲜免费放人
news_tech,腾讯杠上阿里，企业微信打通微信来对抗钉钉？
news_finance,掌阅科技股份有限公司
news_culture,上联：泰山黄山赵本山，如何对下联？
news_tech,微信滴滴不能用了怎么办？
news_military,军民一家亲 共享鱼水情
news_sports,WWE再签一位澳大利亚橄榄球悍将，网友：为了今后的XFL？
news_military,叙利亚遭以色列导弹袭击：连续爆炸火光照亮整个夜空
news_travel,家与烟火，诗与远方，你们会怎么抉择？
news_culture,郭襄丨风陵渡口，一见杨过误终身
news_story,记得回家先喊名字
news_world,印度有什么硬伤，导致它成不了一流大国？
news_car,为什么二手市场那么多哈佛h6？
news_house,百盘耀世 献礼中原｜恒大中原致力于打造美好生活
news_travel,台湾南投有哪些值得购买的手信？
news_tech,从小米正式递交的招股书来看，小米预计估值多少？
news_sports,巴克利预测猛龙会淘汰骑士，G2后巴克利又说猛龙是最令人失望的球队，你怎么看？
news_sports,詹姆斯和乔丹之间是否只差了点运气？
news_world,法国突然宣布重要消息，特朗普大怒，中国却热烈欢迎！
news_finance,“名嘴”操纵股票被证监会处罚1.26亿元，你怎么看？
news_military,以色列警告称如果战机被击落将会轰炸俄军事基地，你怎么看？
news_military,印度国产战机“光辉”参与实战训练 印度全国拍手叫好？
news_tech,你觉得发射卫星与芯片研发哪个更难？
news_game,彩六短讯：Y3S2（第三年第二季）终于即将露出阵容啦
news_entertainment,鹿晗打鼓嘴里念叨：鹿晗真的帅，邓超：你这种心态真的是自恋到家
news_world,普京：俄罗斯需在各领域取得突破
news_sports,巴克利预测勇士火箭4:1，杨毅4:2，这口毒奶勇士喝不？
news_travel,“大美庐江·快乐毅行”2018环冶父山生态旅游毅行活动举行
news_car,大搜车精准打击瓜子 强势改变二手车平台格局
news_tech,为什么滴滴整天被网民骂成“滴滴不死，天理难容”而易到连钱都发不出去却没这么招恨？
news_edu,“桑吉”轮事故最新动态
news_agriculture,这几种适合混栽的“新型”果树，好栽无须多打理，爆棚挂果率高
news_finance,创业可最快速度积累财富？研究显示：创一代已成高净值人群主力军
news_entertainment,拒绝雷同！《幻乐之城》全原创模式 呈现音乐加表演顶级大秀
news_game,如何评价《穿越火线》CF手游版？
news_travel,一样的龙岩，不一样的天空
news_tech,为什么苹果公司敢在我国这么强势？
news_edu,今日成都教育资讯必看全景图
news_culture,上联：泰山黄山赵本山，如何对下联？
news_culture,南充：让年轻人唱主角 非遗走出博物馆展现新魅力
news_edu,二本大学文科分比较低的大学有哪些（最好是四川）？
news_finance,大盘上10000点，还有多远？
news_finance,股票飙升前，庄家都会先“洗盘”，万次交易实战极少出现例外！
news_military,中国制造创新高，出租一天可赚120万，加拿大已签5年租用合同！
news_sports,世乒赛1/4决赛有意外也有惊喜！小胖希望能排到第1位出场！
news_house,北京限价房销售新规征求意见
news_edu,第三代人教数字教材亮相全国基础教育信息化应用展示交流活动
news_sports,快讯！万州体育场将举办国际足球赛（中国队VS朝鲜队）
news_entertainment,梁静茹演唱会尾场，网友：穿得活脱脱一个花仙子！真美！
news_house,市北区（青岛）80个小区最新二手房价，你知道的小区涨了？跌了？
news_edu,与全日制研究生相比，非全日制研究生能被企业认可吗？
news_game,5月12日KPL，对战QG时GK因网络波动暂停后丢掉优势局，这对GK来说公平吗？
news_finance,前4月经满洲里口岸进出境中欧班列达477列
news_military,解放军训练基地附近，一架美军战机坠毁！美：想打架？
news_edu,有会日语的朋友是一种怎样的体验呢？
news_edu,考研｜苏州大学专题：乐队花车效应 2018真题刨根问底
news_sports,看完这些，才明白那些选手为啥跑大马不觉得累！
news_world,怎么看普京要求俄罗斯到2024年前成为全球五大经济体之一？
news_world,一念天堂，一念地狱｜印度，到底是个怎样的国家？
news_edu,浙江2018年普通高校专升本15日开始投档
news_finance,一位股市高手的良言：MACD最全秘技解析，学不会就别炒股了！
news_entertainment,周冬雨虽是个矮个子，但她照样活出专属她的高度来
news_house,乐山新广场旁也有好房 89㎡清水套四带大阳台单价仅5600
news_entertainment,你为你爱豆花了多少钱
news_game,王者荣耀：一级特别擅长打红buff的几位悍将，对手根本抢不到！
news_house,5月7日苏州商品房成交198套，二手房成交374套
news_sports,莫雷：今年是我职业生涯夺冠的最佳机会
news_culture,欧洲人物油画形象中，为何裸体的女性居多？
news_game,只剩1天！《黑暗之魂：受死版》即将正式在Steam下架
news_military,美军驻叙部队准备行动，俄一支摩步团火速集结，美称已做最坏打算
news_game,去年的同仇敌忾今年能否再现，期待洲际赛的再次夺冠？
news_finance,中国股市：下周回落中低吸的时间要领
news_house,老人去世后户口注销了，使用权房屋怎么继承？
news_agriculture,牢记总书记教导：贵州“一减一增”推进农业供给侧改革
news_game,四本经典搞笑网游文推荐，每本都会让你笑个不停
news_travel,退休后，就开这辆B型房车，带着老伴去旅游，享受自由的生活！
news_game,RNG放出春季赛回顾视频，网友们评论没想到连官博都开始摇了
news_car,全面武装 LC200底盘&后备箱升级
news_culture,思想从来不是件简单的差事
news_finance,华讯方舟股份有限公司关于回购注销部分限制性股票的减资公告
news_military,二战故事｜3分钟了解二战前日本军国主义的崛起和国际联盟的纵容
news_military,坦克驾驶员在驾驶时头是伸出来的，如果炮塔转动，会不会碰到头？
news_agriculture,农人双喜向农民朋友推荐：耐旱、抗病、高产的白轴玉米和红轴玉米
news_entertainment,有哪些娱乐圈里面的明星追星？
news_military,全球十大防空导弹盘点：中国只有一款上榜 排第7
news_travel,南京长江路附近有什么好玩的地方？
news_culture,上联：春风吻千树；请接下联？
news_culture,千里婵娟一梦，如何对下联？
news_world,俄罗斯如何修复同乌克兰的关系？
news_car,如何看待观致汽车销量暴增的现象？
news_house,未来房价会跌到什么程度？
news_military,巷战夜战从不吃亏，这些叙政府军为啥这么能打：系伊朗系部队
news_edu,井陉矿区第一小学开展“”家校携手 共创未来”活动
news_car,中山改灯，本田冠道升级完成，亮度提高了3倍
news_culture,上联：泰山黄山赵本山，如何对下联？
news_edu,现在学生学那么多特长有用吗？
news_game,如何看待DNF命运硬币这个道具至今还存在于游戏中？
news_world,为什么大多数国家愿意和美国结盟，而不是俄罗斯？
news_car,凯越正式回归！10万以下搭载的全是高科技，没人再说它是低端车了
news_tech,什么路由器好？
news_finance,宁夏上市公司商赢环球耗资5000万成立教育子公司
news_edu,清华大学2018自主招生初审认定
news_car,东风标志4008与雪弗兰探界者如何选择？
news_finance,2018安徽省阳光人寿安庆中支招聘正式编制人员6人公告
news_finance,生于千亿融资，死于量产：互联网造车幸存者谁？
news_finance,申万菱信基金管理有限公司
news_culture,书法｜知道怎样区分宣纸很重要，关系到出来的作品好不好~
news_entertainment,祝延平演的武松更好，还是丁海峰演的武松更好？
news_finance,未来已来，BATCon全球区块链应用与技术大会暨展览会抢滩八月上海
news_game,RNG领先2万经济碾压越南队，但比赛中的这一失误引发吐槽！
news_finance,涨停股揭秘：新股市场回暖4月上市新股平均8连板 锋龙股份封涨停
news_story,山上突现黑云，老道一去不回，村民收留道童，方知道童不是普通人
news_tech,特朗普为什么否决博通并购高通？
news_entertainment,她一天掉了四十万外国粉，却赢得十三亿国人的心！
news_entertainment,四个家庭合照，陆毅一家全是腿 贾静雯家全是眼睛 陈小春一家……
news_entertainment,郑恺疑似公开恋情？还是比他大5岁，这一对姐弟恋被喊话在一起！
news_sports,世乒赛后国际乒联新排名公布，获得女团冠军的丁宁意外下降，张本进前10，如何看待这件事？
news_tech,福特提出汽车+摩托车合体专利、酷派起诉小米专利侵权、魅族……
news_military,数百枚导弹从天而降！美给出一份绝密清单，我国某地赫然在列
news_story,大姑姐回娘家坐月子却从来不许我进去，我强行推开门却笑出了声
news_tech,刘强东罕见发飙：这类员工不尽快清除，留着过年吗？
news_world,商务部：中国对美方加征关税的态度没有改变
news_entertainment,为大12岁初恋痴狂8年，后分手赌气嫁给初恋的好友，却赌赢了人生
news_entertainment,《复仇者联盟3》上映三天国内票房正式破十亿
news_house,国家统一规划！部分三四线城市的房价可能要跌
news_car,同级里面最美的内饰，V8的发动机，2018款CT6会翻身吗？
news_tech,支付宝又出新动作，几千万的商家都沸腾了
news_culture,「每天一首唐诗宋词」宋·苏轼《青玉案》（附集字帖）
news_finance,如何系统地学习股市？
news_house,柱式空调和柜式空调优点和不足有哪些？
news_agriculture,果农询问，怎么才能让葡萄转色增甜快？
news_sports,刘国梁指导渐渐隐退后，中国男团为什么启用名气并不大的刘国正？
news_sports,重庆当代力帆：伊涅斯塔不会以球员身份加盟
news_tech,OPPO 坚持精品战略，荣获天猫TES“年度消费者体验奖”
news_military,AK47步枪为何成为非洲战乱国家的标配武器？
news_culture,上联：双肩挑世俗，怎么对下联？
news_game,绝地求生刺激战最新幸运舔包 新老用户都可参与
news_military,李云龙到底是凭借什么打败坂田的
news_tech,苏宁无人黑科技时代闪亮登场！快来看看都是哪些黑科技！
news_world,一个学历太低被辞退的日本教师，因帮助过一个中国学生而成为名人
news_edu,要闻｜奉贤区对中小学（中职）学生开展“七彩成长”满意度调研
news_military,日本女护士解救107位中国战士，并嫁给中国军人，拿到我国国籍
news_travel,地理答啦：少数民族地区如何利用自身优势进行旅游开发？
news_travel,世界第一的美国，为什么物价那么便宜？
news_tech,如何评价上市公司38亿收购981个微信公众号？
news_world,如果美国打伊朗，最快可以多久解决战斗？
news_military,台民众抗议美台军火交易 高喊“美军从亚洲滚出去”
news_sports,朱婷回国大场面：几百人接机，50万人看直播，央视在机场直接采访。你怎么看？
news_car,黑客入侵选号系统“抢”靓号 33个三同号车牌被撤销
news_sports,曾经的著名足球解说刘建宏继离开央视和乐视体育，现在去哪了？
news_entertainment,小个子男星也有春天：28年只演丑角，美娇娘却甘做他的小媳妇
news_tech,如何评价任正非和柳传志这两个人？
news_tech,苹果狂刷版本修复IOS 11.4beta4来袭
news_world,为什么大多数国家愿意和美国结盟，而不是俄罗斯？
news_entertainment,吓！汪涵还以为应采儿会说广州话，应采儿说她一直都是说国语的！
news_game,"盘点LPL选手的网红女友, UZI韦神的最气质而Ming的女友是个大牌!"
news_car,如何看待吉利为首的自主品牌已经超越韩系车了吗？
news_agriculture,农村有句俗语“猪来穷，狗来富，猫来开当铺”，这是什么意思？
news_sports,今年NBA骑士有希望夺冠吗？为什么？
news_tech,柳传志到底是个什么样的人？
news_car,日本老人的晚年生活
news_world,你对“美国优先”怎么看？
news_tech,马云最新激情演讲 工资四五千 你的明天怎么活？(7)
news_agriculture,“人造猪肉”于近期面世，猪价会有挽回的余地吗？
news_game,十万玩家彻底退游，绝地求生怎么了？网友称：德玛西亚需要我们！
news_military,造一艘航母有多难？难怪一般国家建不出，说出来你都不敢相信！
news_culture,上联：百鸟朝凤，下联怎么对？
news_military,发挥极致！俄罗斯下水800吨小艇，火力远超中国056！
news_military,血战到底！伊朗军方：一旦美军越过底线，必反击！中俄鼎力支持
news_travel,北海有哪些不错的景点？
news_agriculture,猪价跌破成本 养殖户一头猪亏300元
news_finance,巴菲特股东大会点赞A股市场 还这样谈中美贸易
news_sports,保罗有过哪些与nba西部决赛失之交臂的经历？
news_tech,如果苹果和腾讯真的中断了合作，苹果下架腾讯所有APP，你会换手机吗？
news_culture,出句：林中小鸟自出没，怎么对？
news_entertainment,北京女子图鉴怎么和我认识的北漂女孩不太一样
news_story,我结婚，同事随礼800；他结婚，我随礼300；他在微信上说了15个字
news_edu,北大林校长已经道歉了，网文作者们这回该您了
news_military,空军的战斗机怎么辨认地面上的陆军部队是敌军还是自己国家的部队？
news_sports,cba历史上最差的小外援是谁？
news_entertainment,陈凯歌至交，春晚搭档倪萍，与董卿同居6年，被央视开除今无人知
news_sports,老师：图中这局棋怎么破解？
news_game,王者荣耀李白韩信又被砍！刺客难道真的崛起无望？
news_tech,人民日报新媒体用户总数破3.5亿 “两微两端”推动融合发展
news_military,用兵之法，贵在不复？解放军：不存在
news_edu,莱芜市362名选手竞技“机器人”
news_world,为什么越南人有那么多姓阮的？
news_edu,二本入学，毕业变成一本是一种什么体验？
news_world,约旦首笔中企捐助：来自马云 用于妇女儿童教育
news_finance,“科创引领未来”——未来科技城2.0区域价值研讨会将于周四开启
news_tech,德国SEW，“驱动”全球靠什么？
news_car,汉兰达如何？
news_sports,东部决赛赛程出炉
news_car,汽车销售小姐最怕购车的客户用这3招，这些销售内幕真的让人心寒
news_military,美国“退群”给以色列“壮胆” 伊朗无心恋战？
news_military,民国十大地方军阀哪个最强？他们各自有多少兵力？
news_finance,打工还是创业？迷茫不要紧，先看看过来人的分析（值得收藏）
news_game,影之诗国服无限速攻皇卡组详解 影之诗国服无限速攻皇卡组怎么样
news_car,114年的豪车品牌首推SUV，光看名字就身价不菲，世界上最贵的SUV
news_car,20W以内落地，B级车，有什么推荐？
news_sports,张琳芃遮挡球衣上场，恒大发公告处罚责任人降薪三级，你是怎么看的？
news_military,中国实现航母阻拦索国产化 突破了哪些技术难关
