cat,text
news_finance,股票中的突破形态
news_entertainment,他是最帅的古装男神，10国语言六门武术，演技在线却常演配角！
news_entertainment,陈伟霆和黄晓明真的有差别，难怪baby会选择黄晓明
news_car,驾驶证科目几最难？
news_finance,紫贝龙2017年营收1644万元 业绩亏损1425万元
news_finance,今天主流币大跌的原因是什么？
news_game,超神学院：莫甘娜绑着地球人做肉票，你敢说凯沙没有怜悯之心？
news_entertainment,江疏影自拍被调侃迷之角度？还是跟这两位明星学学自拍吧！
news_sports,重庆斯威辟谣！小白的下一站还是中国吗
news_world,镜头下：普京最不想看见的9个搞笑瞬间
news_tech,理想的游戏手机应该是怎样的？
news_car,没想到车位、墓地、幼儿园都能分期了……
news_culture,下联:夕陽西下已黄昏。上联是什麽？
news_house,为什么三线城市的房价炒的高，开发商跑的也不少？
news_finance,5月6日研报精选：毛利率企稳
news_travel,山东省面积最大、人口最多的三线城市，GDP排名全省第7位
news_sports,为什么现在的家长都送孩子去学习跆拳道、空手道，却没有多少人学习中国武术呢？
news_game,当前版本后期团战最强的三个英雄，第一个秒人只需要0.5秒！
news_world,「美国消息」伊核协议遭废避险重启！
news_car,BMW全新X7，外媒试驾规格抢先看！
news_tech,正面解锁/全面屏兼具 屏下指纹传感器2019出货破亿
news_finance,新消费新文化的机遇在哪里？刘泽辉：抓住新中产阶级的老中青三代
news_tech,大家说现在看不懂马云了，马云反驳：十几年前你们就看懂我了吗？
news_entertainment,电影《江湖儿女》戛纳首映 赵涛新片受国际点赞
news_entertainment,周慧敏出席万达活动，网友：这皮肤快可以捏出水了！
news_finance,2018年5月6日豆粕价格行情走势
news_travel,徒步泸沽湖，探秘女儿国（二）
news_car,皮尺部最大旗舰SUV众泰T800上市 13.98万起 越级配置甩BBA几条街
news_car,本人目前存款有15万，在上海一个月收入一万二，可以入手宝马三系吗？
news_car,2018年买个8万左右的新车，有什么好的推荐吗？
news_sports,上港阵容单薄难以做到三线争冠 大放血自掘坟墓恐一无所有
news_sports,2018年威克多杯全国青年羽毛球锦标赛明日在江苏苏州挥拍开战
news_entertainment,《跨界歌王》套路满满！频现低级问题，靠李菲儿，吴秀波吸引眼球
news_tech,酷狗、酷我、QQ音乐、网易云音乐、虾米音乐、天天动听，哪个版权多，音质音效好？
news_tech,7寸，真全面屏，6000毫安，骁龙845，8+256这样的手机有么？大家会买么？
news_car,夏天发大水时，汽车进到水里时如何逃生？
news_car,质量最次国产SUV，变速箱漏油严重，成为被投诉之王
news_tech,腾讯成2017年全球收入最高游戏公司
news_finance,深圳市维业装饰集团股份有限公司关于签订工程施工合同的公告
news_finance,QDII额度扩容背后的躁动：难抢沪港深基金风头？
news_agriculture,湖北潜江：小龙虾季“虾嫂”忙
news_world,如果日本未来要沉了，中国人是否愿意日本人搬到中国？
news_military,运-8能载多少人？虽是上世纪70年代的产品，但运载量一点也不少
news_culture,假如你有机会穿越到古代，可以带三十公斤的东西，你会选择带什么？
news_world,伊朗和印度的关系怎么样？
news_entertainment,和郑爽一样大方承认整容，待遇却千差万别，网友直呼：是整残了
news_sports,广东德比爆大规模冲突！两队共同目标冲超，但都不满意结果
news_sports,大爆冷！59胜+东部第一，骑士横扫猛龙改写历史
news_sports,杨毅在骑士对阵猛龙的比赛中公然称猛龙后场双枪为垃圾兄弟，你怎么看？
news_agriculture,“张大爷，您家的菜我全包了”
news_entertainment,既然复仇者联盟有惊奇队长，为何不早点让惊奇队长出山？
news_culture,中国传统书法作品欣赏
news_car,自主智联SUV哪家强 4款热门车型全面对比
news_culture,有哪几个姓氏和孔孟颜曾用同一个辈分？
news_tech,爱粉博带你深度分析全网营销策略与推广战术攻坚
news_entertainment,"36岁张钧甯近照，气质美貌不输任何人 ,只是这选男友的眼光太奇特"
news_game,dota2哪个英雄最脏？
news_travel,不用挤平潭！福州出发25分钟，去看梦幻更百倍的网红“蓝眼泪”
news_agriculture,农村汽车不断增多的现象，会带来哪些弊端？
news_tech,币圈 链圈 用圈
news_car,知乎网友：为什么有的小车气味闻着就容易晕车？
news_sports,平心而论，这赛季利物浦三叉戟的欧冠表现是不是不输当年巴萨MSN？
news_sports,重赏之下必有勇夫？面对老板奖励成堆的现金，恒丰能否不辱使命？
news_travel,山东人花5亿仿建江南水乡，被誉为“北方乌镇”，网友：不伦不类
news_world,澳大利亚这一举动难以理解，中国外交部正式提出交涉
news_tech,2017年线上销售中国品牌超七成 天猫新零售打造新“中国名片”
news_culture,下联:静坐窗前听雨声，上联怎么对？
news_sports,再看国家德比：裁判睡着 水爷宇宙中心呼唤爱
news_military,中国“轰-20”正式亮相！五角大楼怒斥：是谁在暗助中国？
news_entertainment,何为苦何为乐？
news_world,有哪些国家有能力替代美国成为世界警察？
news_house,2016年在成都买的房子，已经达到90平以上，怎么落户成都？
news_culture,为何民间总有人说“看了西游记，说话如放屁”？
news_agriculture,2018年5月9日生猪价格行情略有上涨，小幅震荡将是常态？
news_edu,汶川十年巨变 见证中国力量
news_sports,MSI小组赛第二天比赛日，香锅打F6的时候被闪电狼发现，为什么不去送塔反而送出一血？
news_edu,哪个汽修学校好？
news_house,房子离婚后怎么分割？没出钱的一方能得到吗？
news_travel,10个影响民宿选址的因素，分布的11个区域，构成中国民宿聚落地图
news_tech,区块链的应用太多，了解这几个最热门就够了
news_culture,出句：月下诗魂冷，如何对句？
news_world,唐尼的2008年钢铁侠服装从仓库被偷走
news_entertainment,生日祝福全都无，欢乐颂中的五美你怎么看？
news_game,街头采访矿工媳妇，干煤矿的爷们们都看哭了！
news_game,RNG.M 24连胜居然被YTG在第一局就终止，对此你有什么看法？
news_agriculture,为什么低劣农产品大家争相购买，而我的顶级农产品却卖不出去？
news_entertainment,「Apink」「新闻」180509 等待Apink营业！制作人疑剧透新曲
news_military,你绑记者我抓你父母，阿富汗特种部队一招让绑匪低头认输
news_finance,疯狂打板族：妖股背后的深圳游资
news_tech,一下科技创始人韩坤：2018年短视频风口依旧强劲
news_finance,兴民智通（集团）股份有限公司
news_sports,火箭队遭太阳顶薪挖墙角！卡佩拉和多位角色球员只能二选一？
news_agriculture,农村这野草，埃及用来防尸腐，印度拿它保护灵魂！
news_tech,区块链与金融行业，区块链改造传统金融行业？
news_culture,四川发现20余座成汉时期墓葬 出土大量文物
news_entertainment,《上海女子图鉴》女主上海十年男友比戚薇少，每个大有来头超有钱
news_travel,洱海真是个漂亮的地方，网友：要人要跟我一起约洱海吗？
news_military,二战鬼子拼刺刀有多厉害？
news_finance,春夏，又到了玩转平安信用卡去吃喝玩乐的季节
news_tech,谷歌开启Android 9.0时代，vivo 率先发布安卓P定制版本
news_travel,兴义人的酒量大啊！猜猜在贵州排第几？
news_entertainment,江疏影拍摄心得“光不够，枕头凑”，荣耀10：其实真的不用这么拼
news_sports,如果总决赛，火箭打骑士与勇士打骑士哪个胜算大，为什么？
news_culture,“心有猛虎，细嗅蔷薇”是什么意思？
news_tech,既是机器人又是手机，这么好玩有趣的家伙，你不想了解下？
news_travel,溯溪裸泳 林中吸氧 云端露营 树下乘凉——雪峰山旅游开启避暑模式
news_game,你第一次充钱是为哪款游戏？
news_sports,保安神技一脚踢飞老鼠，网友称：这技术当什么保安呐，国足需要你
news_story,弟弟结婚我给五万，第二天弟媳在群里发个红包，我退出娘家群
news_agriculture,怎样进行仔猪黄痢防治？
news_military,印尼军事实力比起越南如何？
news_sports,勇士113:104鹈鹕成功晋级，4巨头合砍94+33+27的完美数据，如何评价？
news_house,数据告诉你：去美国投资，买公寓还是独栋？
news_house,这两个户型哪个好？
news_house,房子十年后会涨十倍吗？
news_culture,东北少帅张学良是历史的罪人还是历史的功臣？
news_culture,道德经第十章
news_culture,如何以此图作诗一首？
news_finance,中国股市无人知晓的秘密：选股坚持只看三条线，值得散户读10遍！
news_tech,马云励志演讲：机会那么多，你却选择打工，因为你没有野心
news_culture,去武汉旅游，哪里最能体验地道的“过早”文化？
news_edu,教师如何提高课堂教学有效性？
news_culture,古代时刻表是怎样的，古时的午时三刻到底是11:45还是12：45？
news_edu,长沙雨花区投巨资推进教育信息化
news_game,为什么战士刺客都要带百穿铭文，到底有什么好处？
news_culture,仰韶文化彩陶图案中人面鱼纹彩陶盆是公认的彩陶艺术精品
news_car,男大学生用什么香水会比较好？
news_world,俄一架武装直升机在叙利亚坠毁 致2名飞行员死亡
news_finance,债市指标为股市释放一个重要信号 投资路线图曝光
news_world,日本和以色列为什么会在贫瘠的土地上建立起高度发达的国家？
news_travel,长治市旅发委携专家团队为杨家池乡村旅游谋新篇
news_entertainment,半丸子头如何扎，才能清纯又减龄
news_game,中国人在游戏中有多厉害？
news_tech,证监会披露廖英强案经过：从荐股视频切入 大数据筛查
news_tech,扫地机器人实用吗？
news_sports,布雷特·布朗认为76人“需要帮助才能赢得总冠军”
news_finance,2018年尿素市场行情怎么样，种地人可以备耕吗？
news_military,大型武器被卖给另一国，是怎么运输过去的？这一方法军迷都没听过
news_sports,牛！埃德森抛踢球距离超70米，创吉尼斯纪录
news_car,17款斯柯达野帝1.4T前行款怎么样？现在值得入手吗？
news_entertainment,唐嫣宣传《归去来》被追问什么时候结婚？回击8个字，导演都笑了
news_travel,厦门最值得入住体验的两家五星级酒店都出自YANG设计
news_world,美国到处制造动乱，招致了一些国家的反对，你是否认为美国已成为世界公敌？
news_game,表现太差今天TL启用替补辅助 国外网友表示并不看好
news_car,新款保时捷Macan轻伪谍照曝光 将于年底上市
news_culture,上联：满山红叶诱人醉，怎么对下联？
news_edu,都说中国人数学比西方人好，那为什么几乎所有的数学公式都是西方人发明的？
news_travel,盈盈千年渔村，幽幽鱼米之乡
news_agriculture,农村老话“人穷断六亲”，“六亲”指哪些人？该如何看待这句话？
news_car,各种类型汽车坐垫对比，你选对了吗？
news_edu,报考指南｜新生报考自考，是选择专业还是选择学校？
news_tech,这些国产品牌，都是中华骄傲，华为、小米、老干妈上榜
news_edu,刘瑜留给你印象最深的是哪句话？
news_tech,为什么好多人微信不绑银行卡？
news_car,机动车与行人发生交通事故的责任承担规则
news_tech,手机之前删除的照片，简单一招立马恢复，每个画面都充满了回忆
news_tech,如何看待阿里钉钉CEO的言论：不知道你们10点之前下班干嘛，不到1点不合格？
news_military,世界四大战争狂人
news_travel,昆明老太太，带领一家三代，马来西亚自由行，我给您点赞（上）
news_culture,方舟子说象棋源自印度，中国古代没有大象，你认为这种说法怎么样？
news_finance,注意！工资收入分配新政将出台！这类人群钱袋子要涨
news_tech,原来vivo手机屏幕隐藏一个功能，下滑就能使用，可惜知道的人太少
news_car,福特改灯哪里专业 福特蒙迪欧改灯 福特大灯升级 广州汽车改灯
news_sports,中国象棋与围棋有多少种变化？
news_car,大众旗下很少见C级车辉昂，这气派真不是一般B级车能比的！
news_culture,陕西省旬阳县太极城文化研究会挖掘蜀河古镇文化暨旅游开发故事
news_military,揭秘：从日军那里缴获大炮，为何不充分利用，而是藏起来或者毁掉
news_travel,成为一个合格的深圳人，需要多少步？
news_entertainment,鹿晗和迪丽热巴，网友：这么般配，为什么在一起的不是你们
news_agriculture,业内人士：未来猪场所需能繁母猪会越来越少
news_entertainment,唐嫣甜美现身一脸娇羞 穿粉色抹胸裙露香肩秀长腿，身材瘦成闪电
news_travel,周末打算从广州去南宁玩，想问问南宁有什么可以拍照的好地方吗？
news_sports,同样打死亡五小，火箭要放格林，杨毅表示勇士就得放塔克，你怎么看？
news_edu,考生迟到2分钟被拒进入高考考场应该吗？
news_sports,对于巩晓彬与青岛男篮分道扬镳问题你怎么看，你认为逍遥王会回山东男篮吗？
news_car,“义乌造”车睡神器，爱车秒变房车，女朋友直呼太棒了
news_game,《魂斗罗：归来》什么才是近战强兵？冰河时代诠释美得暴力
news_house,成都现在最适合买房的位置是哪里？
news_sports,冰岛世界杯23人大名单出炉：西古德森领衔 12名替补
news_entertainment,昆凌出国度假不忘运动 周杰伦怨「能放松一下吗？」
news_edu,这些“双胞胎”汉字，难倒无数人，你能分清楚吗?
news_game,斗鱼绝地求生一哥已停播一周 参与职业战队试训表现抢眼有望留队
news_tech,山东启动质量链 让百姓买得放心
news_house,如何判断买房的好时机？这六点要考虑全面！
news_game,《元气骑士》《黑魂3》合体？像素风《挺进地牢》获IGN8.5评分
news_car,比亚迪宋max这款车总体性能怎么样，油耗能达到多少？
news_finance,80年前的那场货币战
news_story,聊了一个月，领了两千多红包，居然告诉我不合适？
news_finance,为什么郑州成为中国内陆综合实力最强的城市？
news_finance,中国光谷6月底将建成20座5G基站
news_edu,上课时学生手机响个不停，老师一怒之下把手机摔了，家长拿发票让老师赔，大家怎么看待这种事？
news_world,迪拜这么有钱，为何没被恐怖分子盯上？土豪们笑了
news_car,仅在尺寸上有优势的领克01，配置上被VV5完爆
news_entertainment,抄检大观园后，袭人为什么骂晴雯不是东西？
news_entertainment,俞飞鸿出席活动，网友：终于看到一个坐下以后没有翘二郎腿的女星
news_travel,四川游客张某带着六名女子在三亚沙滩烧烤被撒沙，这事你怎么看？
news_tech,为何小米总能首发出配置高通芯片的手机？
news_car,2013款帕萨特1.8T用嘉实多机油5-30的可以吗？
news_travel,中国比较有名的小吃街都有哪些？
news_agriculture,城市户口，合法取得的农村宅基房屋能确权到名下吗？
news_sports,2018年“咸马”11月11日开跑 比赛路线优化升级，报名通道近期开启
news_house,成都的房子什么时候能跌？
news_entertainment,她们就是女版的刘德华和梁朝伟，一个美若天仙，一个演技超神
news_military,中途岛战役中，日本航母为什么一炸就废，美国航母的战损率却很低？
news_sports,四川男篮新赛季能卷土重来横扫辽宁夺冠吗？
news_agriculture,玉露不用买，自己在家就能种，多到花盆放不下！
news_finance,【龙虎榜】环能科技5月9日成交明细
news_tech,教你把手机锁屏密码设置为文字，比数字锁屏好看100倍，超好玩！
news_finance,快讯：汇嘉时代涨停 报于13.96元
news_game,「怎样快写硬笔字」：挑的写法，用途广泛，连笔较多，巧妙使用
news_entertainment,「MD PHOTO」韩国女艺人 李妍秀任棒球比赛开球嘉宾
news_agriculture,乡村振兴前景好 返乡创业人不少
news_tech,劳力士手表在哪个国家买最便宜？
news_house,为什么很多企业家都说“未来投资房子是最大的错误”？
news_sports,英超：南安普敦（主）vs 曼彻斯特城
news_edu,开眼界 | 小学六年级男生情书
news_car,比捷达耐用开30万公里不用修 很多人却不识货
news_tech,vivo手机打开这个功能后，就能将手机画面投影到汽车挡风玻璃上
news_finance,五种！现金流量表的编制方法
news_tech,华为手机升级安卓8.0怎样报名内测？
news_game,LOL剑圣又要火了？新版本装备改动梦回AP时代
news_game,EDG为什么会被不强的RW零封？
news_travel,2018，我在稻城亚丁等你
news_entertainment,昆凌与助手穿“情侣装” 周杰伦吃醋：哪里怪怪的
news_world,伊朗的这份核协议到底该不该修改？
news_tech,联想把5G关键票投给了高通，掀起全国的舆论风暴，企业有权利按照自己意愿决择吗？
news_world,萌生退意 中情局女掌门涉虐囚丑闻恐难转正
news_car,豪华小车他比宝马MINI更潮，卖15万有终身质保买回家很放心
news_culture,上联：柳随风动不争东西南北；怎么对下联？
news_house,绿地还要赖多久？拖欠海南数百家分销上千万佣金长达四五年！
news_tech,打造人联网、车联网、物流联网和电联网四网合一
news_car,大众最帅气的轿跑，比宝马3系还漂亮，无边车窗，才21万元
news_finance,散户法宝：利用底部反转时常用的三种买进时机把握
news_edu,期中成绩出来了，孩子如果考得不好，花2分钟看看这文章！
news_house,海宁的地 卖出了实际近两万元楼面地价 贵在哪里？
news_sports,上港1-2输给国安的比赛中，国安后卫刘欢的手球，没有判罚点球，是不是误判？
news_entertainment,曾与唐嫣杨幂刘诗诗并列新四小花旦的她，如今还能翻身吗？
news_sports,“格斗狂人”徐晓冬最近忙打假？ISKA世界业余搏击比赛什么来头？
news_sports,凯尔特人，勒布朗一生的对手！
news_travel,旅途——朱树清：请来石门温泉浴
news_culture,茶水先生读《诗经》261：韩奕——恩威并施稳固北方
news_game,KaKao重回LCK！曾经的挖煤野王现在究竟怎么样？
news_car,这些交通标志扣分最多 有的人一个都不认识
news_game,阴阳师里的彼岸花和塔罗牌是什么关系？
news_car,汽车熄火后，开双闪多久车子会没电？
news_travel,世界上最大的是什么？
news_finance,明全策：黄金冲高遇阻寻支撑，伦敦金窄幅区间看反弹
news_game,周瑜和鲁班嘲讽宫本，结果宫本让他们经历了绝望
news_military,"中国高超音速飞机试飞成功,五倍音速超“黑鸟”是真的吗？"
news_game,6399：CF手游鹰眼地图防守技巧 CF手游鹰眼保卫者打法攻略
news_agriculture,隆回穷山村走出大老板！回老家投资400万，助力全村脱贫！
news_edu,双语：关于身体的12个神奇事实
news_military,如果希拉里上台了会不会主导和俄罗斯交战？
news_house,房地产翻倍涨价，实体经济却不好做，你怎么看待？
news_car,1分都没扣，驾照还是被吊销了？！只因……
news_entertainment,确认过这眼神，就是张继科、马龙、许昕等马上就要来深圳啦！
news_finance,明天，会黑周四吗？
news_culture,“老子圣像精品展”在陕西周至楼观台展出
news_sports,杜兰特38+9+5库里23分 浓眉26+12勇士擒鹈鹕3-1
news_travel,最后4天！沩山密印景区将恢复门票收费
news_car,对Ei5心生喜欢，实力表现还好吧？
news_edu,《别说你不懂数学》：趣味盎然的数学科普著作
news_finance,盘点！去年嘉兴哪些上市公司最赚钱？哪些职位能拿高薪
news_sports,7岁男孩公交上用脚踢男子，男子猛摔小孩并狂踩其头部被拘留15天，你怎么看？
news_entertainment,给富豪生了3个孩子奖了40亿，如今小小举动看出她的真实感受
news_military,国产055大驱一次至少建造5艘？一旦加装电磁炮，性能将再度提升
news_sports,8大外援对抗一球未进！恒大权健坠落的真实原因呼之欲出
news_finance,10万元存款利率10.0%合算吗？
news_world,尼日利亚军方从“博科圣地”手中解救千名人质
news_world,巴西南部一起交通事故致９人死亡
news_game,英雄联盟KZ战队的上单khan赛后接受采访表示：“打RNG只用了三成功力”，你怎么看？
news_finance,能在上海开奥迪A6L的人是什么样的？
news_sports,144年首次！中国马主首夺美国最著名肯塔基德比赛马冠军
news_military,中东两霸威胁开战！上千枚导弹互相瞄准 美俄也无能为力
news_agriculture,2018.5.12全国猪价，猪价低迷，小猪场和大猪场，哪个能称到最后
news_finance,拓维信息实际控制人继承股份过户完成
news_culture,上联：公鸡打架头对头，下联怎么对？
news_military,中国空军有哪些战机，各自优势是什么？三四代皆有、高低搭配
news_culture,新帝登基时，面对父皇留下的众多妃子，怎么处理？
news_house,泉州今年将成立超10个物业调解委员会
news_military,6倍音速刺穿反导火力网！中国一款“老爷机”终于雄起了
news_culture,A18 聚焦文博会 “香的世界”绽放立新湖畔
news_military,伊朗当前军事实力能否抗衡以色列？
news_edu,临平一小南枝校区9月启用
news_game,外媒入围赛预测：只有KaBuM能挡住SUP的前进
news_agriculture,种鹅产蛋期的饲养技术分析
news_entertainment,合伙人排挤你会有哪些表现？
news_edu,自考考下来也是挺有难度的可为什么在社会中自考毕业生很受歧视？
news_tech,Vivo X21和小米6X，选择哪个比较好？
news_travel,乌镇有哪些好玩的地方？
news_sports,猛龙别哭！这4支东部球队都被詹姆斯打到重建了，他们比你还惨
news_house,两个人手写的房子合同，没有去公证处公证，有法律效力吗？
news_edu,大学毕业，选择创业好，还是考单位好？
news_finance,中国企业“走出去”应加强风险识别与风险管控
news_car,18款中东版丰田酷路泽4000尽显酷路泽沙漠越野气质
news_game,廖化的能力到底怎么样，关羽战死后，他是如何逃回去的？
news_culture,上联：黄山黄河黄皮肤黄土高原。怎么对下联？
news_finance,中国婚趴集团加盟商合影集
news_tech,如果男(女)朋友有一天要看你手机，你会毫不犹豫地给他(她)看吗？
news_entertainment,如何快速的在音乐播放器上找到脑中出现的旋律？
news_tech,2018，马化腾与马云的梦
news_edu,母女共传承 喜迎护士节
news_edu,一个第一！两个第二！感受峄城力量
news_car,花甲女人的轮胎情愫
news_edu,处罚体育老师很容易，让家长明白上体育课不能穿凉鞋却很难！
news_tech,COOLGO专车表示：出行安全是网约车行业发展的基石
news_tech,手机为什么取消了内存卡？
news_world,这个黑人国家太强，只比美国和加拿大弱一丝，对中国游客免签
news_tech,为什么滴滴还在亏损？
news_travel,翻开哥哥的旅游包，天呐！全都是新鲜“稀罕货”，好玩到停不下来
news_tech,iPhone X、华为p20 pro和三星s9+，不考虑价格的话，选哪个好？
news_world,美国宣布暂停对土售武，土耳其声称将采取报复措施，你怎么看？
news_entertainment,“美队”克里斯·埃文斯接演《第九区》导演灾难新片
news_edu,广西二本大学的排名是怎样的？
news_car,临渭交警：不文明交通违法曝光台 行人的你是否在其中！
news_agriculture,土壤板结、烂根、结果少、不甜！一张图看懂猕猴桃存在问题
news_finance,财政部：不得通过“指导投标”干预地方债发行定价
news_agriculture,要想种出优质苹果，土、肥、水管理是基础，疏花疏果是关键
news_car,为何F1六缸就可以干掉布加迪16缸？
news_game,Fami通展示《无双大蛇3》首批截图以及艺术宣传图
news_travel,“滆湖之星”观光塔
news_world,《东京食尸鬼》中铃屋什造是男的还是女的？
news_game,KZ战队击败RNG战队杀手锏 Pray偷学走A怪双修EZ压制Uzi
news_entertainment,YY文静三联唱《干了这杯酒》+《情面》+《为自己干一杯》很有气势
news_game,王者荣耀：韩信对李白做了什么，让李白大喊要对我负责！
news_sports,马德里赛德约科维奇力克锦织圭！卡·普利斯科娃险胜阿扎伦卡！
news_sports,第三届延庆女子半程马拉松5月12日鸣枪 预热北京世园会
news_car,45万的玛莎拉蒂曝光，比卡宴更霸气，比揽胜更豪华，谁还买BBA
news_military,俄罗斯大阅兵，这些装备证明其武力值依然爆表
news_finance,东源物流2017年营收1.12亿元 业绩亏损214万元
news_agriculture,立夏苗山农事忙
